"I try to see your accepted payment methods",1
"help me list your available payment methods",1
"I am trying to see your allowed payment methods",1
"i do not know hoow i could check ur reimbursement policy",1
"help me check your money bck guarantee",1
"need assistance to check in what cases can i request refunds",1
"can I check in what cases can I ask to be reimbursed?",1
"could you show me in what situations can I ask for refunds?",1
"I try to check in which cases can I ask to be reimbursed",1
"can I see in which cases can I ask to be refunded?",1
"I have to see your refund policy, can you help me?",1
"how can I check your reimbursement policy?",1
"help me see in what cases can I ask to be reimbursed",1
"can uhelp me to see in which cases can i ask to be refunded",1
"wanna check in what cases can i ask to be reimbursed",1
"see in what situations can I request a reimbursement",1
"can you help me check in which cases can I ask for refunds?",1
"I have got to see your money back policy, how can I do it?",1
"i need help seeing in what cases can i ask for my money back",1
"wanna check ur refund policy i need help",1
"is it possible to see in what cases can I request refunds?",1
"help seeing in what situations can I request reimbursements",1
"I am trying to see in what cases can I request a refund",1
"assistance seeing in what cases can i request reimbursements",1
"I want assistance checking how long refunds take",1
"i have got to check ur money back guarantee how do i do it",1
"want assistance to check how long refunds take",1
"help me seeing in which situations can I ask for refunds",1
"can you help me seeing in what cases can I request refunds?",1
"wanna check ur money back guarantee how can  i do it",1
"seed under which circumstances can I ask for a refund",1
"i want help to check in what cases can i ask for a reufnd",1
"help checking in which cases can i request a reimburement",1
"help to see in what cases can I ask to be reimbursed",1
"I am trying to see in what cases can I request my money back",1
"see in what situations can I request my money back",1
"is it possibpe to check how long refunds take",1
"help checking in what cases can I request to be reimbursed",1
"could I check in which cases can I ask to be reimbursed?",1
"can ya show me in what situations can i ask to be reimbursed",1
"i want help checking in which cases can i ask for a refund",1
"I want to check in which situations can I ask to be refunded",1
"help to see in what cases can I ask for my money back",1
"help seeing in which situations can I ask to be reimbursed",1
"see in what situations can I ask for a refund",1
"help to see your money back policy",1
"show me in what situations can I request refunds",1
"assistance to check in what situations acn I request refunds",1
"could I see in what cases can I ask for a refund?",1
"help to see in what situations can I ask  for refunds",1
"help me check in what cases can I request to be reimbursed",1
"where can I check your reimbursement policy?",1
"show me in which cases can I ask to be refunded",1
"help to see in what situations can I ask to be refunded",1
"assistance seeing your money back policy",1
"I have to see in what cases can I request a refund",1
"see in which cases can I request my money back",1
"I need to check your reimbursement policy, help me",1
"I want to check in which cases can I request my money back",1
"want help seeing in which cases can I requesr a refund",1
"assistance seeing ur money back guarantee",1
"show me in which situations can I ask to be reimbursed",1
"I have got to see your refund policy, how could I do it?",1
"check ur money back guarantee",1
"help me see in which situations can I ask to be refunded",1
"need assistance to check in what cases can I ask for refunds",1
"i try to see ur reimbursement policy",1
"I want to see in what cases can I ask for refunds",1
"in what situations can I ask to be reimbursed?",1
"can i check how long reimbursements usually take",1
"help me  to see in what situations can I ask for a refund",1
"I have to see under what circumstances can I ask for refunds",1
"I have got to see how long refunds take",1
"I have to see your refund policy, will you help me?",1
"i have to see how long refunds take",1
"I'm trying to check how long reimbursements take",1
"I have to see in what situations can I ask to be reimbursed",1
"help me see in what situations can i request a reimbursement",1
"can you show me in what situations can I request refunds?",1
"assistance seeing in what cases can I ask to be reimbursed",1
"I can't see your money back policy",1
"I have got to see how long refunds take, help me",1
"in what cases can i request to be refunded",1
"I hav to see your refund policy, how can I do it?",1
"what is your money back guarantee?",1
"I am trying to check your bloody reimbursement policy",1
"can you help me see how long refunds take?",1
"help seeing under what circumstances can I request refunds",1
"I try to see in which situationscan I ask for refunds",1
"i need help checking in what cases can i ask  to be refunded",1
"check in what situations can I request a reimbursement",1
"i cant see ur money back policy",1
"I need to see in which cases can I request the damn refunds",1
"I am trying to check your money back guarantee",1
"help seeing your reimbursement policy",1
"in what cases can I ask foir a refund?",1
"I want to see how long refunds take",1
"i want help to see in what cases can irequest refunds",1
"I have to see how long reimbursements take, I need help",1
"need to check in which cases can i request an reimbursement",1
"I have to see in which situations can I ask to be refunded",1
"help to see your fucking money back policy",1
"help me check in which casesx can I ask for reimbursements",1
"could I see in what situations can I request my money back?",1
"could you show me inwhat cases can I ask for refunds?",1
"I have to see in what situations can I ask for a refund",1
"can I check in what cases can I request the damn refunds?",1
"I have to see how long reimbursements usually take, help me",1
"in what situations can i ask for a refund",1
"I need help seeing your refund policy",1
"are the charges of ur services reimbursable",1
"I am trying to see in which cases can I ask for refunds",1
"I need to see in which situations can I ask for a refund",1
"could I check in what cases can I ask to be reimbursed?",1
"I need to check your refund policy , how to do it?",1
"help me see in what cases can i request a reimbursement",1
"help me seeing ur refund policy",1
"in which situations can I ask for a goddamn reimbursement?",1
"want assistance seeing your money back policy",1
"could you help me check your money back guarantee?",1
"help seeing in what situations can I ask to be refunded",1
"I wouls like to see your money back guarantee, help me",1
"I want to see in what cases can I request refunds, help me",1
"I have to check how long reimbursements usually take",1
"can you help me seeing your refund policy?",1
"I want help seeing in which cases can I ask for a refund",1
"can you help me see in what cases can I ask to be refunded?",1
"I am trying to see in which cases can I ask to be refunded",1
"could I see in which cases can I request a fucking refund?",1
"I need to check in which cases can I ask for my money back",1
"can you help me check your goddamn reimbursement policy?",1
"i have to check in what cases can i ask for reimbursements",1
"want help seeing in which cases can i request a refund",1
"I cannot check your reimbursement policy",1
"assistance to check in whih cases can I ask for refunds",1
"help to check in what situations can I request a refund",1
"i want assistance seeing how long reimbursements take",1
"see how long refunds usually take",1
"help to see in which cases can I ask for refunds",1
"check in what cases can I request to be reimbursed",1
"wanna see ni which situations can i ask for a refund",1
"I need help seeing how long reimbursements usually take",1
"wanna check in what cases can i request a refund",1
"want assistance to check your refund policy",1
"I want help to check in which cases can I ask for refunds",1
"need help to check in which cases can i ask to be refunded",1
"I need assistance seeing how long refunds take",1
"help me to see in which cases can I request a reimbursement",1
"I want to see your  refund policy",1
"can I see in what cases can I ask for reimbursements?",1
"how do I check your money back policy ?",1
"i want help to check how long reimbursements take",1
"see in what cases can I request refunds",1
"help me seeing in what cases can I request reimbursements",1
"wanna see how long refunds take could ya help me",1
"help me see under what circumstances can I request a refund",1
"I need to check how long rimbursements take",1
"want assistance to see how long refunds usually take",1
"show me in which situations can I ask to be refunded",1
"would it be possible to see how long reimbursements take?",1
"show me in which cases can I request to be refunded",1
"i have to see in what cases can i ask for reimbursements",1
"I need assistance seeing how long the goddamn refunds take",1
"could I see in what situations can I ask for refunds?",1
"can I see in what cases can I ask for a reimbursement?",1
"assistance seeing in what situations can i ask for refunds",1
"help me check in which cases can i ask for reimbursements",1
"I want assistance to see your money back guarantee",1
"need help seeing ur reimbursement policy",1
"can ya help me see in which situations can i ask for refunds",1
"help to check in which cases can i erquest my money back",1
"I'd like to see ur money back guarantee how to do it",1
"check under what circumstances can i request a reimbursement",1
"help me see in what cases can I reuest my money back",1
"can i see in which situtaions can i request refunds",1
"I try to see in which cases can I request a refund",1
"I'd like to see in which situations can i ask for reunds",1
"help seeing your money back  policy",1
"i want assistance to check how long refunds usually take",1
"I want to see in which situations can I ask for refunds",1
"help me seeing your damn refund policy",1
"show me under which circumstances can I ask to be reimbursed",1
"I want to see in which cases can I ask to be reimbursed",1
"could I see in what cases can I request to be refunded?",1
"see in which situations can i request to be reimbursed",1
"I want tocheck in which cases can I request to be reimbursed",1
"I wwould like to see your damn money back policy, help me",1
"I'm trying to see in what cases can i request refunds",1
"I need help to see in which situations can I request refunds",1
"I want assistance to see your money back policy",1
"help me check in which situations can I request refunds",1
"I want to check your regund policy, help me",1
"I want to see your refund policy, how to do it?",1
"help seeing in which cases can I ask for reimbursements",1
"help checking in which cases can I ask for reimbursements",1
"I try to see in what cases can I request refunds",1
"I cannot see your bloody reimbursement policy",1
"can you help me seeing in what cases can I request a refund?",1
"see in what cases can I ask for a refund",1
"I have to check in what situations can I request a refund",1
"need to checkin which situations can i ask to be refunded",1
"can i check how long refunds usually take",1
"I need help seeing your reimbursement policy",1
"i try tosee under what circumstances can i ask for refunds",1
"I have to see in which cases can I ask for a reimbursement",1
"show me in which situations can I ask for reimbursements",1
"can I check how long reimbursements usually take?",1
"help me to see in what cases can i request a reimbursement",1
"I want to see how long refunds take, how to do it?",1
"I want help to see in what cases can I ask to be refunded",1
"help me seeing how long the damn reimbursements take",1
"is it possible to see in which cases can i ask for refunds",1
"I need help seeing in which cases can I ask for a reufnd",1
"help me to check in which cases can i ask for reimbursements",1
"i have got to see in which cases can i request my money back",1
"could ya help mw check ur reimbursement policy",1
"can i cxheck in which cases can i ask for refunds",1
"I don't know how I can see your money back guarantee",1
"check under what circumstances can i request refunds",1
"I want help seeing in what situations can I request refunds",1
"help me checking how long reimbursements take",1
"want assistance seeing in what cases can I request a refund",1
"wanna check in wshat situations can i ask for a refund",1
"assistance to see your goddamn money back guarantee",1
"I try to see in what cases can I request a refund",1
"help me check in which situations can i ask to be refunded",1
"i have to check ur refund policy can i get some help",1
"I'm trying to see in which cases can i request refunds",1
"i have to see in which cases can i ask for erimbursements",1
"need help to check in which cases can i request refunds",1
"I want to check your reimbursement policy, how do I do it?",1
"i have to check in what cases can i ask for refunds",1
"I have to see your money back policy, I need help",1
"under which circumstances can I ask for my money back?",1
"check in which situations can I request my money back",1
"assistance to check in what cases can I ask to be refunded",1
"I am trying to see in what situations can I request refunds",1
"assistance checking your reimbursement policy",1
"I am trying to see how long refunds usually take",1
"can you show me in which situations can I request refunds?",1
"I try to see in what cases can I ask to be refunded",1
"help me checking in what cases can I ask for  reimbursements",1
"I don't know how I can check your refund policy",1
"I need to see your goddamn refund policy, how do I do it?",1
"i want assistance to check how long refunds take",1
"assistance to check in which cases can i request a refund",1
"I need to check how long reimbursements usually take",1
"I want to see your money back guarantee, can you help me?",1
"help to see in which cases can I request ym money back",1
"I have got to check in what cases can I request a refund",1
"I want to see in what cases can I request my money back",1
"I want to check in what cases can I request to be reimbursed",1
"I need to see your refund policy",1
"need to check in which cases can i request an refund",1
"I try to see in which cases can I request to be refunded",1
"I have to see how long reimbursements take, how can I do it?",1
"help me see in what situations can i request to be refunded",1
"I need to see how long reimbursements take",1
"I need assistance seeing your goddamn money back guarantee",1
"can I see in what situations can I request to be reimbursed?",1
"I need to see in what cases can I request reimbursements",1
"help checking your money back policy",1
"I need to see your damn money back policy, how do I do it?",1
"i try to check in which cases can i ask for an reimbursement",1
"i try to see in which cases can i request refunss",1
"i need help seeing ur reimbursement policy",1
"help me checking ur reimbursement policy",1
"check in what cases can I ask for refunds",1
"help me checking in which situations can I ask for refunds",1
"need to check how long the goddamn refunds take help me",1
"i have to see in what situations can i ask for refunds",1
"see under what circumstances can I ask to be refunded",1
"help to see in what cases can i request my money back",1
"need help seeing in what cases can i ask for reimbursements",1
"chek in which cases can I request reimbursements",1
"where can i check ur reimbursement policy",1
"help to see in what cases can I request  to be refunded",1
"help me check in which cases can I ask to be reimbursed",1
"need help seeing in what situations can i ask to be refunded",1
"I need to see how long reimbursements take, how can I do it?",1
"need to check in which cases can i ask for reimbursements",1
"I try to check in which cases can I ask for a refund",1
"want help to see in which situations can I ask for refunds",1
"II need to see your reimbursement policy",1
"I need to see your money back policy, can you hep me?",1
"help to check in what situations can I ask to be refunded",1
"assistance to check youe money back guarantee",1
"want assistance seeing your reimbursement policy",1
"i have to check in which cases can i ask for a refund",1
"I would like to see in which cases can I ask to be refunded",1
"help me seeing in what cases can I ask for refunds",1
"how long do refunds take?",1
"I have to check in what cases can I request a refund",1
"I want help seeing your reimbursement policy",1
"i have gotto check ur damn refund policy help me",1
"help seeing under which circumstances can I request a refund",1
"help to see in what cases can I ask for a reimbursement",1
"help me to see in what situations can i request a refund",1
"in what cases can I ask to be reimbursed?",1
"want help checking in wht situations can i request refunds",1
"I want to see in what cases can Iask to be refunded",1
"assistance to check ur refund pollicy",1
"help checking in which situations can I ask to be reimbursed",1
"inwhat situations can I ask to be reimbursed?",1
"I need help to see in which cases can I request refunds",1
"I need to see in which cases can I ask for a reimbursement",1
"help me to check in which cases can I ask for refunds",1
"help me checking in what cases can I request to be refunded",1
"help checking in which cases can I request a fucking refund",1
"I am trying to see in what cases can I request refunds",1
"under what circumstances can I ask to be reimbursed?",1
"show me in which situations can i request my money back",1
"how to check ur refund policy",1
"how can i check ur money back guarantee",1
"I don't know how I can check your reimbursement policy",1
"show me in which cases can I request a refund",1
"need to see in what situations can i ask to be refunded",1
"help me check in what situations can I ask to be reimbursed",1
"I want to check in what cases can I request refunds",1
"need to check how long refunds take how can i do it",1
"am I entitled to a refund according to your policy?",1
"want help seeing in which situations can I ask for a refund",1
"what do i have to do to see ur money back guarantee",1
"I need help to se how long the bloody reimbursements take",1
"help me see under which circumstances can I ask for a refund",1
"see in what situations can I ask for refunds",1
"I want to see under what circumstances can I ask for refunds",1
"I want to check in which cases can I request reimbursements",1
"wanna check under which circumstances can i ask for a refund",1
"i have to check ur money back guarantee help me",1
"wanna check in which cases can i ask for a refund",1
"I need assistance to see your refund policy",1
"I need to see your money back guarantee, can you help me?",1
"can you help me check in which cases can I request a refund?",1
"check in which cases can I ask to be refunded",1
"can ushow me ur refund policy",1
"i try to see in what cases can i ask for a refund",1
"help to check in what cases can i request reimbursements",1
"I have to see how long refunds take, I need help",1
"I want help to check in which cases can I ask for a refund",1
"I want to check your money back guarantee, I need help",1
"how could I check your money back guarantee?",1
"help checking in which cases can i request a reimbursement",1
"assistance seeing your refund policy",1
"I try to see in which cases can I request a reimbursement",1
"help to check in which cases can I request my money back",1
"need assistance to see in what cases can i ask for refunds",1
"I want to see under what circumstances can I request refunds",1
"show ur money back guarantee",1
"I want to check in which situations czn I ask for a refund",1
"assistance to see in what situations can i ask for a refund",1
"help me check in which cases can I request refunds",1
"I try to check in what casescan I request a reimbursement",1
"wanna see ur refund policy how to do  it",1
"hlp seeing ur money back guarantee",1
"can i see in which cases can i as for reimbursements",1
"help me to see in what cases can I ask for a damn refund",1
"help seeing in what cases can i request refunds",1
"can I see under what circumstances can I request a refund?",1
"i need help checking ur refund policy",1
"can I check your reimbursement policy?",1
"I would like to see in which cases can I request a refund",1
"can you help me see in which cases can I ask for refunds?",1
"see in which cases can I ask to be reimbursed",1
"help to check in which cases can I ask for refunds",1
"want help checking ur reimbursement poliicy",1
"assistance seeing in what casew can i ask to be refunded",1
"help me see under which circumstances can i request a refund",1
"help me to check in what situations acn I request a refund",1
"I don't know what I have to do to see your money back policy",1
"I'd like to see how long refunds  take help me",1
"I have to check in what cases can I request my money back",1
"wanna see ur money back plicy",1
"I want to see in what situations can I ask for my money back",1
"help me see in what cases can I ask for a refund",1
"I need help checking in what cases can I ask for a refund",1
"help me seeing in which situations can I request a refund",1
"i have tosee in which situations can i request refunds",1
"check in what situations can I request to be reimbursed",1
"I have got to check your money back guarantee, how to do it?",1
"i dont know what to doto check ur money back policy",1
"assitsance seeing in which cases can i request a refund",1
"show me in which cases can I request to be reimbursed",1
"i cannot check ur money back guarantee",1
"i have to check in what situatins can i ask to be reimbursed",1
"are service charges reimbursable?",1
"I have got to see your money back policy, help me",1
"can you show me in what cases can I ask to be refunded?",1
"help seeing ur money back guarantee",1
"help seeing in which situations can I request my money back",1
"help me see in what cases can I request a refund",1
"need help to see in what cases can I ask for refunds",1
"are charges of services refundable",1
"help to check your damn money back guarantee",1
"I have got to check your reimbursement policy",1
"I am trying to see in what situations can I ask for a refund",1
"I need to check how long the goddamn reimbursements take",1
"need help to see in which cases can I request my money bac",1
"in which cases can I ask for my money back?",1
"help to see in which cases can i ask for my money back",1
"need to check ur money back ugarantee",1
"i have to check how long refunds take how can i do it",1
"check in which cases can I ask for a fucking reimbursement",1
"I would like to see how long reimbursements take",1
"I need help checking in what cases can I request refunds",1
"I'd like to check in which situations can i ask for a refund",1
"i have to check how long reufnds take how to do it",1
"help me seeing in what cases can I request a reimbursement",1
"see in which cases can i ask for a reimbursement",1
"help to see inwhich situations can I ask to be refunded",1
"help me check in what cases can I request a reimbursement",1
"can i check under which circumstances can i request a refund",1
"see in which cases can I ask for my goddamn money back",1
"see in what situations can I ask to be refunded",1
"I need to check in which cases can I ask for a reimbursement",1
"can I see in which cases can I ask to be reimbursed?",1
"i have to see in what cases acn i request my money back",1
"check how long reinbursements usually take",1
"I need to check in which situations can I ask for a refund",1
"I have to see in which cases can I ask for refunds, help me",1
"I try to see in what situations can I ask to be refunded",1
"want help seeing how long refunds take",1
"show me in which cases can I request refunds",1
"help to see in what situationscan I ask to be reimbursed",1
"help seeing in which situations can I request refunds",1
"help me seeing how long reimbuursements take",1
"need help ot check in what cases can I ask for refunds",1
"I would like to see in which cases can I ask for refunds",1
"i do not know how i can check ur money back guarantee",1
"can uhelp me to see how long reimbursements usually take",1
"in which cases can I request refunds?",1
"I want help to check in what cases can I request a refund",1
"I want to see in which cases can I request my money back",1
"I cannot see your reimbursement policy",1
"I need help seeing how long reimbursements take",1
"what si your money back guarantee?",1
"can I check your refund policy?",1
"under which circumstances can I request refunds?",1
"want help to see your reimbursement policy",1
"can you help me checking your reimbursement policy?",1
"I have got to see in which situations can I ask for a refund",1
"I try to see in which cases can I ask for reimbursements",1
"need help to see in what cases can I request my money back",1
"I need to see in which cases can I request refunds, help me",1
"help checkig in what situations can i ask for a refund",1
"I need help seeing how long refunds usually take",1
"are charges for services reimbursable?",1
"can you show me in what situations can I ask for refunds?",1
"can huelp me check ur refund policy",1
"I need to check how long reimbursements take, help me",1
"need assistancee to check your damn reimbursement policy",1
"help seeing in what cases can i request to be reimbursed",1
"ur refund policy",1
"I am trying to check in what cases can I request a refund",1
"can I see in which situations can I request to be refunded?",1
"could I check in which cases can I ask for my money back?",1
"I try to check in which situations can I ask for a refund",1
"could I see in what situations can I ask for reimbursements?",1
"check in what situations can I request a fucking refund",1
"how could I check your money back policy?",1
