"problems with the methods for shipment",1
"I want help to check what shipping methods are there",1
"I am looking for the delivery options, can you help me?",1
"can you help me seeing the methods for shipping?",1
"I need help checking what shipment options you offer",1
"I need assistance checking the options for shipment",1
"do you ship  to {{Delivery Country}}?",1
"do you deliver to {{Delivery Country}}?",1
"help to check what options for delivery are there",1
"shipping to {{Delivery Country}}",1
"would it be possible toplace a fucking order from {{Delivery City}}",1
"would it be possible to see what shipping methods are there?",1
"I want help to check what shipping options I have",1
"i have got to see the delivery methods how do i do it",1
"check the available methods for delivery",1
"i want help seeing what delivery options i can choose",1
"is it possible to place an order from {{Delivery City}}",1
"is it possible to place an order from {{Delivery City}}",1
"help me seeing what delivery methods I can choose",1
"I want help to check what damn delivery methods I can choose",1
"is it possible to place an order from {{Delivery City}}",1
"is it possible to order from {{Delivery City}}?",1
"I would like to check the options for shipping",1
"is it possible to place an order from {{Delivery City}}",1
"need help checking what shipment methods I can choose",1
"I have problems with the options for shipment",1
"d uship to {{Delivery City}}",1
"I have to check the shipping options, will you help me?",1
"can i place an order frim {{Delivery Country}}",1
"can you show me what shipping options are there?",1
"can i place an order frim {{Delivery Country}}",1
"could I place an order from {{Delivery Country}}?",1
"can i place an oeder from {{Delivery City}}",1
"what do I need to do to check the goddamn shipping options?",1
"can I place an order from {{Delivery Country}}?",1
"I want assistance to see what shipment options are available",1
"do uship to {{Delivery City}}",1
"need help seeing when my packageis going to arrive",-1
"I need to see how soon can I expect my damn order, help me",-1
"I don't know how to see how soon can I expect my parcel",-1
"help me to check how soon can I expect my article",-1
"I need to check how long it takes for my shipment to arrive",-1
"I call to check how sono can I expect my order",-1
"I have to see how soon can I expect the item, help me",-1
"where can I check how soon can I expect the goddamn article?",-1
"how can I see how soon can I expect the product?",-1
"I try to check how soon can I expect the purchase",-1
"wanna know about the delivery period",-1
"can oyu tell me about the shipping period?",-1
"I have to see when my purchase is going to arrive, help me",-1
"i need help to see when will my article arrive",-1
"i call to check when will my article arrive",-1
"I have got to check when will my parcel arrive, I need help",-1
"I want information about the shipping period",-1
"i try to check how long itg takes for the shipment to arrive",-1
"I need to see how soon can I expect the order, help me",-1
"I call to check how soon can I expect my product",-1
"assistance to see how long it takes for my item to arrive",-1
"can i check when my package is gonna arrive",-1
"I have to see when will my item arrive, I need help",-1
"help me check how long it takes for the parcel to arrive",-1
"I do not know how I can check when will my package arrive",-1
"can I check how long the shipping takes?",-1
"i want help seeing when will my itwm arrive",-1
"help me to check how soon can I expect the damn article",-1
"where do I see how long it takes for the purchase to arrive?",-1
"how long does it take for a delivery to arrive?",-1
"assistance checking how soon can I  expect the delivery",-1
"how do i check how son can i expect my item",-1
"how can I check when my bloody product is going to arrive?",-1
"help me see when my order is going to arrive",-1
"can utell me about the delivery periods",-1
"I am looking for the shipping period, where can I find it?",-1
"can you show me how long it takes for my shipment to arrive?",-1
"where can I see when will my article arrive?",-1
"can you help me see when my order is going to arrive?",-1
"can you help me see how soon can I expect the order?",-1
"help checking when my article is going to arrive",-1
"I have to check how long it takes for the purchase to arrive",-1
"I want to check when will my purchase arrive",-1
"how do I see how long it takes for my bloody item to arrive?",-1
"I want assistance to see when will my purchase arrtive",-1
"could i check when my package is gonna arive",-1
"I have to check when will my item arrive, I need assistance",-1
"i try to check how soon can i expect the product",-1
"I have got to see how long the delivery takes, I need help",-1
"I have got to check how soon can I expect the goddamn order",-1
"assistance seeing how soon can I expect my article",-1
"I want to see how soon can I expect my order, how to do it?",-1
"I am trying to see how soon can I expect the purchase",-1
"I want help seeing when will my purchase arrive",-1
"help to check how long it takes for the delivery to arrive",-1
"can you help me seeing how soon can I expect my order?",-1
"I want assistance seeing when my item is going to arrive",-1
"i want assistance to check how soon can i expect my item",-1
"could I check how long it takes for my order to arrive?",-1
"I want to see how long the shipping takes, how can I do it?",-1
"I want to check when will my product arrive, how do I do it?",-1
"help to see how soon can I expect the article",-1
"where do I check how soon can I expect my package?",-1
"assistance to check how soon can I expect my parcel",-1
"I have to check how soon can I expect the order",-1
"I call to check when my delivery is going to arrive",-1
"I am looking for the bloody shipping period",-1
"where can I check how soon can I expect the product?",-1
"I need to see when will my package arrive, help me",-1
"I try to see when my delivery is going to arrive",-1
"wanna see how long it usually takes for the order to arrive",-1
"can you help me see how soon can I expect the product?",-1
"I call to see how soon can I expect my parcel",-1
"I need to see how soon can I expect my shipment, help me",-1
"can you show me when my product is going to arrive?",-1
"how to check how soon can I expect my article?",-1
"can you give me information about delivery periods?",-1
"how can I check how soon can I expect my parcel?",-1
"i want assistance to check how soon can i expect the article",-1
"I want help to check how soon can I expect my product",-1
"help me check when my fucking package is going to arrive",-1
"how can I see how son can I expect my package?",-1
"i want help to check when wqill my package arrive",-1
"i need assistance seeing how soon can i expect the delivery",-1
"want help to see how long it takes fo the article to arrive",-1
"I need to see when my order is going to arrive, help me",-1
"I want help seeing when will my item arrive",-1
"how do i check when my purchase is gonna arrive",-1
"I have got to see when will my parcel arrive, help me",-1
"i need help checking how long the shipment takes",-1
"I call to see when my product is going to arrive",-1
"I have got to see how soon can I expect the fucking item",-1
"can ya show me when my purchase is gonna arrive",-1
"what do I need to do to see how soon can I expect my item?",-1
"I try to see how soon can I expect the parcel",-1
"could uhlep me to check how soon can i expect the damn order",-1
"I  need assistance to see when my article is going to arrive",-1
"how do I check how long it takes for the product to arrive?",-1
"how to check how soon can i expect the article",-1
"need to see how soon can i expect the order could uhelp me",-1
"need to check how soon can i expect my product",-1
"how do I see when my item is going to arrive?",-1
"how do i ese when will my package arrive",-1
"i want assistance seeing when my parcel is gonna arrive",-1
"how can I see how long it takes for my item to arrive?",-1
"I want to see when will my package arrive, can you help me?",-1
"can you hsow me how long it takes for the article to arrive?",-1
"I have to check when my bloody package is going to arrive",-1
"how can I see how long it takes for the damn item to arrive?",-1
"wanna know more about delivery period find some information",-1
"could you help me seeing how soon can I expect the article?",-1
"assistance to check hw soon can i expect the order",-1
"I call to see when my goddamn package is going to arrive",-1
"want help seeing how soon can i xepect my item",-1
"I need to see when will my parcel arrive, how to do it?",-1
"how to see when my product is going to arrive?",-1
"help me to check when my item is gonna arrive",-1
"i tfy to see how soon can i expect my shipment",-1
"want help seeing how long it takes for my shipment to arrive",-1
"how do I check when will my purchase arrive?",-1
"I need to see how long it takes for the shipment to arrive",-1
"can you help me seeing when my article is going to arrive?",-1
"I want to check how long the shipment taes, how can I do it?",-1
"help to see when my purchase is going to arrive",-1
"I am looking for the shipping periods, how can I find them ?",-1
"what do i have to  do to see when will my parcel arrive",-1
"assistance to check how long it takes for my item to arrive",-1
"how do I see how long it takes for the item to arrive?",-1
"where can I find information about shipping periods?",-1
"could I see when will my article arrive?",-1
"need help to see when my product is gonna arrive",-1
"find information about shipping period",-1
"I need help to check when my purchase is going to arive",-1
"need help to see when my purchase is gonna arrive",-1
"I need assistance checking when my item is going to arrive",-1
"how could I check how soon can I expect my order?",-1
"how can i check how logn it takes for the package to arrive",-1
"how can I check how soon can I expect the parcel?",-1
"I am looking for information about the shipping period",-1
"how do I check when my damn parcel is going to arrive?",-1
"wanna check how long the shipment takes i need help",-1
"can ya help me to check when my product is gonna arrive",-1
"can you help me seeing how soon can I expect my parcel?",-1
"I have to see how soon can I expect my package",-1
"assistance seeing how long it takes for my order to arrive",-1
"I try to check how long it takes for the parcel to arrive",-1
"assistance seeing how long it takes for my parcel to arrive",-1
"i have got to check when will my item arrive",-1
"Ineed to check how long the shipment takes",-1
"where can I see when my package is going to arrive?",-1
"I'm calling to see when my delivery is gonna arrive",-1
"how do I check how soon can I expect my package?",-1
"I need assistance to see when will my article arrive",-1
"want assistance checking when  will my package arrive",-1
"could you help me see how soon can I expect my package?",-1
"is it possible to check when will my parcel arrive?",-1
"what do i have to do to check when will my parcel arrive",-1
"want help checking how sooncan i expect my article",-1
"help seeing how soon can I expect my product",-1
"help me sde how soon can i expect my item",-1
"where can i see how long the shipping takes",-1
"help me checking how long it takes for the order to arrive",-1
"I want to see how soon can I expect the parcel, I need help",-1
"I wsant assistance seeing how soon can I expect the item",-1
"need assistance to see how soon can i expect my parcel",-1
"i need help to see how soon can i expect the parcel",-1
"how can i see how long it takes for the parcel to arrive",-1
"I am trying to find the shipping perod",-1
"I am looking for the shipping periods, I need help",-1
"can you help me seeing how soon can I expect my purchase?",-1
"help me see when will myarticle arrive",-1
"I need to check when my parcel is going to arrive",-1
"help me checking when will my package arrive",-1
"i want help seeign when will my product arrive",-1
"help checking how soon can I expect the product",-1
"i dont know how i can see when will my article arrive",-1
"help me to check when will my parcel arrive",-1
"can I check when my article is going to arrive?",-1
"what is the shpiping period?",-1
"help me to check how soon can I expect the article",-1
"show me how long it takes for my order to arrive",-1
"I am trying to check how soon can I expect my parcel",-1
"where can i check how soon cn i expect my shipment",-1
"where can I check when my product is going to arrive?",-1
"I call to check how long it takes for the purchase to arrive",-1
"I am calling to check how long the shipment takes",-1
"i dont know how i could see when my shipment is gonna arrive",-1
"tell me more about shipping period",-1
"i need help seeingwhen will my package arrive",-1
"how to see how soon can I expect the article?",-1
"I am trying to check how soon can I expect my purchase",-1
"can I see how long it takes for my article to arrive?",-1
"can you show me how long the shipping takes?",-1
"how long does it take for a damn article to arrive?",-1
"i have  to see how long it takes for my purchase to arrive",-1
"I want help checking when will my article arrive",-1
"can I see how soon can I expect the fucking item?",-1
"want help seeing how soon can I expetc my article",-1
"where do i see when my product is gonna arrive",-1
"I'm trying to check how long the shipping takes",-1
"I want to see when will my product arrive, I need help",-1
"what is the delivery period for this parcel",-1
"how to see how long it takes for my package to arrive?",-1
"I do not know how to see when will my item arrive",-1
"i have to check how soon can i expect tne article",-1
"need to check when my order is gonna arriev",-1
"I want help seeing how soonj can I expect my parcel",-1
"can i check how long it takes for my order to arrive",-1
"help me checking how long it takes for the article to arrive",-1
"is it possible to check when my shipment is going to arrive?",-1
"I don't know how to check when my aprcel is going to arrive",-1
"what do I have to do to see when will my article arrive?",-1
"I have to check how long the shipment takes, I need help",-1
"want hel seeing how long the shipping takes",-1
"where can I see when my roder is going to arrive?",-1
"i try to see how soon can i expect the shipment",-1
"I have to see how soon can I expect the goddamn order",-1
"I need help checking when my parcel is going to arrive",-1
"I try to check when will my article arrive",-1
"is it possible to see how soon can I expect the order?",-1
"ned to see when will my package arrive",-1
"I don't know what to do to check when will my parcel arrive",-1
"where to check when my product is going to arrive?",-1
"I need to see when will my product arrive",-1
"can you show me when will my product arrive?",-1
"can you help me checking when will my parcel arrive?",-1
"how to check how soon can i expect the item",-1
"help me see how long it takes for my article to arrive",-1
"I don't know how I can see when will my item arrive",-1
"I want to see how soon can I expect the goddamn package",-1
"I am looking for the shipping periods, I need assistance",-1
"I want help checking when my article is going to arrive",-1
"I need assistance to check when will my product arrive",-1
"I need help seeing how soon can I expect my parcel",-1
"wanna see how soon can i expect my parcel i need assistance",-1
"I need help seeing how soon can I expect my purchase",-1
"need help seeing how soon can i expect my package",-1
"could you help me see how soon can I expect my parcel?",-1
"i have to see how long the delivery takesi need help",-1
"I don't know what to do to see how soon can I expect my item",-1
"how can I see how long the shipping takes?",-1
"i haqve got to check when my delivery is gonna arrive",-1
"i need assistance checking how soon can i expect my package",-1
"wanna see when my item is gonna arrive how could i do it",-1
"can you help me check how soon can I expect the product?",-1
"how do i check  when will my parcel arrive",-1
"want help checking how soon can i expect my shipment",-1
"where to see when my order is gonna arrive",-1
"need help seeing how soon can i expect the shipment",-1
"I want assistance to see how soon can I expect my purchase",-1
"how do I see how soon can I expect the bloody delivery?",-1
"how do I see how long it takes for  the item to arrive?",-1
"I need assistance to see when my product is going to arrive",-1
"need to see how long it usually take for the item to arrive",-1
"I have to check how soon can I expect the purchase",-1
"need  help seeing how soon can i expect my package",-1
"give me information about the shippong periods",-1
"I am calling to see when will my product arirve",-1
"can uhelp me check when will my item arrive",-1
"want help checking ohw soon can I expect my package",-1
"I call to check how soon can I expect the item",-1
"how to see how soon can I expect my goddamn product?",-1
"I need assistance seeing how soon can I expect the purchase",-1
"need help checking how soon can I expect my item",-1
"I want to check when will my product arrive",-1
"I have to see how long it takes for the product to arrive",-1
"I want to see when will my product arrive, help me",-1
"I am trying to see how soon can I expect the shipment",-1
"i try to see how soon can i expect my shipment",-1
"need help to see how soon can I expect the delivery",-1
"where do i check when my shipment is gonna arrive",-1
"help me to see how soon can I expect my parcel",-1
"I'm trying to see how long it takes for my product to arrive",-1
"i need assistance checking how soon can i expect my product",-1
"need to check when my parcel is gonna arrive help me",-1
"want help checking when will my product arrive",-1
"I don't know how to check how soon can I expect the parcel",-1
"I want to check how long the shipment takes",-1
"i need help to check how soon can i expect the order",-1
"i want assistance to see how soon can i expect the item",-1
"I have got to see when my package is going to arrive",-1
"wanna check how soon can i epect my delivery help me",-1
"how can I see how long it takes for the article to arrive?",-1
"I want to see how soon can I expect my damn order, help me",-1
"I try to see how soon can I expect my fucking package",-1
"I want information aboujt shipping periods",-1
"I try to see how long it takes for my parcel to arrive",-1
"I want to see how long it tyakes for my package to arrive",-1
"I do not know how to check how soon can I expect the parcel",-1
"help me to see how soon can I expect the shipment",-1
"I have to check when will my package arrive, I need help",-1
"help to see when will my package arrive",-1
"I have got to see how long the shipment takes, I need help",-1
"help me to see when my shipment is going to arrive",-1
"assistance to see when will my product arrive",-1
"i have to see how long it takes for the package to arrive",-1
"I have to check how long it takes for my delivery to arrive",-1
"help me to see how long it takes for my damn order to arrive",-1
"I try to see how soon can I expect my shipment",-1
"help me check how soon can I expect my fucking product",-1
"I'm calling ot check when my parcel is gonna arrive",-1
"I'm trying to find the deliveey periods",-1
"want help to see how soon can I expect the purchase",-1
"can i check how soon can i expect my delivery",-1
"help me seeing how soon can I expect my parcel",-1
"help seeing when will my package arrive",-1
"how do I see how soon can I expect my package?",-1
"help checking how long it takes for the shipment to arrive",-1
"I am trying to check how soon can I expct my parcel",-1
"is it possible to see when my product is going to arrive?",-1
"want help to chck how soon can i expect my order",-1
"how soon can I expect my parcel ?",-1
"show me how long it takes for my package to arrive",-1
"i want help checking how soon can i expect the order",-1
"where to  see how soon can I expect my order?",-1
"I need help to check when my package is going to arrive",-1
"how can I check how soon can I expect the article?",-1
"need assistance checking how soon can I expect the shipment",-1
"how do I check when my shipment is going to arrive?",-1
"I don't know how I can see when will my parcel arrive",-1
"i need assstance to check how soon can i expect the order",-1
"I am trying to check how soon can I expect the damn shipment",-1
"I don't know how to check how soon can I expect the product",-1
"can I check when will my purchase arrive?",-1
"I have got to see when will my aprcel arrive",-1
"i have got to see how soon can i expect my delivery",-1
"i call to check how long it takes for the item to arrive",-1
"I want assistance to check how soon can I expect the package",-1
"I want help seeing how soon can I expect my goddamn order",-1
"help to check how soon can I expect the purchase",-1
"I want help to see how long it takes for the order to arrive",-1
"I  do not know how to check when will my product arrive",-1
"where do I check how long it takes for my product to arrive?",-1
"I don't know how I can see how soon can I expect my item",-1
"how do i check how long it takes for my item to arrive",-1
"help me see when my damn article is going to arrive",-1
"I want help checking how soon can I expect the delivery",-1
"i dont know how i can ese how soon can i expect the order",-1
"I call to check how long it takes for ym article to arrive",-1
"can you hlp me seeing when my product is going to arrive?",-1
"need help to check how soon can I expect my parcel",-1
"wana check how soon can i expect my order i need help",-1
"how to check how long it takes for my delivery to arrive",-1
"can you help me seeing when my product is going to arrive?",-1
"i have to see how long it takes for my delivery to arrive",-1
"I don't know how to see when my package is going to arrive",-1
"assistance to see how soon can I expect my shipment",-1
"I want to know about the shipping periods",-1
"could oyu tell me about fucking shipping periods?",-1
"can you help me to see when my product is going to arrive?",-1
"where could I see how soon can I expect the product ?",-1
"I do not know how I can see when will my purchase arrive",-1
"how do I see how soon can I expect the goddamn product?",-1
"can you show me how long it takes for my delivery to arrive?",-1
"I have to see how long it takes for the shipment to arrive",-1
"I'm caalling to check how soon can i expect the damn order",-1
"how long does the shipping take",-1
"can you help me see when my product is going to arrive?",-1
"can you help me to check how soon can I expect the package?",-1
"assistance to check how soon can i exepct the purchase",-1
"where to check how long it takes for my delivery to arrive",-1
"I try to see how long it takes for my article to arrive",-1
"I need assistance checking how soon can I expect my product",-1
"wanna see how soon can i expect my delivery how to do it",-1
"can i check when my bloody shipment is gonna arrive",-1
"need to check wwhen my shipment is gonna arrive can uhelp me",-1
"i have to see how long it takes for the packgae to arrive",-1
"i have got to check how soon can i expect the order",-1
"how do i see how long it takes for my delivery to arrive",-1
"where can I check when will my product arrive?",-1
"I call to check how long it takes for my shipment to arrive",-1
"can uhelp me see how sooj can i expect the product",-1
"I want assistance checking when my order is going to arrive",-1
"help to see how long it takes for the delivery to arrive",-1
"help me to check how soon can I expect the parcel",-1
"wanna see how soon can i expect the package how to do it",-1
"I want to check how long it takes for the order to arrive",-1
"is it possible to see how soon can i expect my delivery",-1
"I am trying to se how long the shipment takes",-1
"I have to ese how soon can I expect the article",-1
"I don't know what to do to check when will my article arrive",-1
"assistance to check how soon can I expect my purchase",-1
"can ya help me see how soon can i expect my item",-1
"where do I see how soon can I expect my article?",-1
"can I see how long it usually takes for the item to arrive?",-1
"i want assistance checking how soon can i expect the item",-1
"show me how long it takes for my article to arrive",-1
"I don't know how to see when my delivery is going to arrive",-1
"help to see how soon can I expect my order",-1
"I'mlooking for shipping period can uhelp me find them",-1
"will ya show me how long the shipping takes",-1
"help me see when will mny purchase arrive",-1
"where to check how soon can I expect my product ?",-1
"assistance checking when my article is going to arrive",-1
"I am trying to find shipping periods",-1
"help to check how long it takes for the product to arrive",-1
"i have got to check when my shipment is gonna arrive",-1
"help me checking how soon can I expect my parcel",-1
"assistance checking when my purchase is going to arrive",-1
"how do I check how long it takes for my package to arrive?",-1
"I want to check when my item is going to arrive",-1
"want help to see when my parcel is gonna arrive",-1
"i dont know how to check when my product is gonna arrive",-1
"I have to see how long the shipment takes, I need help",-1
"wanna see how long it usually takex for my parcel to arrive",-1
"could you show me how soon can I expect my product?",-1
"where can I check how soon can I expect the item?",-1
"where do I check how soon can I expect the item?",-1
"where to see how long the delivery takes?",-1
"I want help checking how long the shipment takes",-1
"I call to check how soon can I expect my package",-1
"will you show me how soon can I expect my purchase?",-1
"I want assistance seeing when will my item arrive",-1
"can uhelp me check when my order is gonna arrive",-1
"I try to see how long it takes for my delivery to arrive",-1
"I need to see how long it takes for my parcel to arrive",-1
