"I need help seeing a what time customer service available is",-2
"need help to talk to customer assistance",-2
"see what hours I can get in touch with customer assistance",-2
"I have to check at what time I can reach customer support",-2
"can ya help me ccall customer support",-2
"check at what time i can reach ucstomer service",-2
"I have got to talk with customer support, I need assistance",-2
"how do I see at what time I can call customer support?",-2
"ya have a free number to talk with customer service",-2
"do you have a toll-free customer assistance phone no?",-2
"I want to speak with customer service, helpme",-2
"can uhelp me to contact customer service",-2
"how do I call customer assistance?",-2
"tell me what hours I can get in touch with customer service",-2
"show me what hours i can call customer assistance",-2
"how can i see at what time i can call customer assistance",-2
"what do I need to do to call cusromer support?",-2
"I don't know how to talk with customer service",-2
"assistance to see what hours i can call customer service",-2
"uhave a free number to call customer support",-2
"I try to check what hours I can contact customer support",-2
"how to speak to customer support ?",-2
"speaking with customer support",-2
"how can i contact customer support",-2
"wanna ceck what hours i can contact customer assistance",-2
"I am trying to speak to fucking customer support",-2
"I try to check at what time I can call customer service",-2
"I want help to talk to customer support",-2
"I need help to talk to custmoer service",-2
"I want to speak with damn customer support, help me",-2
"assistance to see at what time I can call customr service",-2
"I need help to see at what time I can reach customer service",-2
"do you have a toll-free number to reach customer support?",-2
"how could I see what hours I can call customer assistance?",-2
"I need help calling customer assistance",-2
"i dont know how i can call customer assistance",-2
"help me see at what time customer support available is",-2
"help to see at what time i can reach customer support",-2
"help talking to customer assistance",-2
"where do I see what hours I can contact customer service?",-2
"how do i check at what time i can call  customer service",-2
"where do i see at what time i can call customer assistance",-2
"I need assistance to talk with damn customer service",-2
"how do I check at what time I can contact customer support?",-2
"do uhave a free damn no to talk to customer service",-2
"I have got to check what hours customer service available is",-2
"help to check at what time customer support available is",-2
"need help to check whathours i can call customer assistance",-2
"help me see what hhours I can call customer assistance",-2
"can I check at what time I can call customer support?",-2
"I am trying to talk with custojer service",-2
"i try to check whathours customer support available is",-2
"need to get in touch with customer assistance how to do it",-2
"I don't know what I have to do to call customer service",-2
"help me see at what time I can call customer service",-2
"i dont know how i can contact customer service",-2
"can i get in touch with customer support",-2
"I need to speak to customer support, can you help me?",-2
"help me to see what hours I can contact customer service",-2
"I want help to call customer assistance",-2
"help me to call customer support",-2
"I don't know what to do to speak with customer assistance",-2
"help me see at what time I can call customer assistance",-2
"I do not know what I need to do to contact customer service",-2
"do you have a number to get in touch with customer support?",-2
"need to see what hours customer assistance available is",-2
"see at what time i can call customer support",-2
"can ya help me see what hours i can reach customer service",-2
"I do not know how I can get in touch with customer service",-2
"I try to check what hours I can contact customer service",-2
"I am trying to check what hours I can call customer support",-2
"i want help to speak with customer assistance",-2
"uhave a free number to speak to customer service",-2
"where do i check what hours i can contact customer support",-2
"I want help seeing what hours I can reach customer service",-2
"where can I see at what time I can contact customer support?",-2
"I have to talk to customer service, I need assistance",-2
"could i get in touchwith customer service",-2
"help contacting damn customer support",-2
"I have to talk to customer support, I need help",-2
"assistance to see at what time I can reach customer support",-2
"can uhelp me see what hours i can contact customer service",-2
"what do I have to do to talk with bloody customer support?",-2
"will you tell me what hours I can contact customer support?",-2
"do uhavea toll-free number to speak to customer assistance",-2
"could you tell me what hours customer support available is?",-2
"wanna see what hours cdustomer support available is",-2
"how do I see what hours I can contact customer support?",-2
"I need help talking with customer service",-2
"I need to speak with customer support, help me",-2
"I need help to see what hours customer support available is",-2
"help me seeing what hours I can contact customer assistance",-2
"need help seeing at what time I can call customer assistance",-2
"I am trying to check what hours I can reach customer support",-2
"i have to contact customer assistance how to do it",-2
"i have got to get in touch with customer support help me",-2
"I need to contact customer service, hoow can I do it?",-2
"I need to talk with customer support, how todo it?",-2
"where do I see what hours I can reach customer support?",-2
"can you help me to speak with customer assistance?",-2
"I need help to check what hours I can call customer support",-2
"i need help to see what hours customer support azvailable is",-2
"I need help to call customer assistance",-2
"assistance seeing what hours customer service available is",-2
"help me seeing what hours I can call customer service",-2
"i want assistance to get  in touch with customer service",-2
"I don't know how to speak to customer assistance",-2
"i have got to see at what time customer support available is",-2
"what do I need to do to call customer service?",-2
"i have to check at what time i can contact custome support",-2
"help me see what hours I can call customer support",-2
"can you help me speaking with customer service?",-2
"I want assistance talking with customer service",-2
"what do I need to do to contact customer assistance?",-2
"help checking what hours I can call customer service",-2
"I would like to talk with customer support, how do I do it?",-2
"I don't know how I can talk to cstomer support",-2
"how to check at what time i can call customer support",-2
"i need assistance to speak with customer service",-2
"can I contactcustomer assistance?",-2
"I want to check what hours I can reach customer support",-2
"what is the ucstomer support working hours",-2
"i have to talk to customer service",-2
"I don't know what to do to call customer service",-2
"I have to talk to customer assistance, I need help",-2
"need to check what hours i can call customer service",-2
"wanna talk with customer assistance",-2
"I have to get in touch with customer service, I need help",-2
"check at what time customer support available is",-2
"how do I check at what time I can call customer support?",-2
"I want help to see at what time I can reach customer service",-2
"could I talk to customer support?",-2
"I have to talk with customer assistance, how can I do it?",-2
"I need help to speak with customer assistance",-2
"how do I see at what time I can contact customer service?",-2
"want help to see what hours I can call customer assistance",-2
"need to talk to customer service will ya helpme",-2
"help me calling customer assistance",-2
"anyone available at customer assistance",-2
"need to seee at what time i can contact customer support",-2
"how do I see what hours I can contact customer service?",-2
"wanna contact customer assistance",-2
"I need assistance getting in touch with customer support",-2
"what is ur customer assistance mail",-2
"can you help me get in touch with customer service?",-2
"how can I see what hours I cn contact customer support?",-2
"help checking what hours customer support available is",-2
"help seeing what hours I can contact customer assistance",-2
"I have to talk with customer support, I need help",-2
"I need help to call damn customer support",-2
"I want help to check what hours I can reach customer support",-2
"uhave a mail address to get in touch with customer support",-2
"help calling customer support",-2
"uhave a free of charge number to contact customer support",-2
"how do I speak with customer support?",-2
"how to check whatg hours I can reach customer support?",-2
"I need to get in touch with customer support",-2
"help checking at what time I can call customer support",-2
"I have got to talk with customer support, I need help",-2
"I want to talk with customer assistance, could you help me?",-2
"help getting in touch with customer assistance",-2
"help me see what hours I can reach customer support",-2
"where to check at wnat time customer assistance available is",-2
"help me see at what time customer service available is",-2
"I don't know what I have to do to talk to customer service",-2
"I need to call customer assistance, how could I do it?",-2
"I want help to see what hours I can call customer assistance",-2
"help me to see what hours I can reach customer support",-2
"i have to check what hours i can reach customer service",-2
"help me to see at what time i can reach customer service",-2
"do you have a toll-free customer service number?",-2
"can you help me call fucking customer sujpport?",-2
"how to check what hours I can reach customer support?",-2
"I don't know what I haveto do to speak with customer service",-2
"I don't know what I have to do to call customer support",-2
"can you show me what hours I can call customer service?",-2
"where to see at what time customer support available is?",-2
"I don't know how I can get in touch with customer support",-2
"how do i check what hours i can call customer assistance",-2
"I have to speak with customer support, how can I do it?",-2
"I want help to talk with customer assistance",-2
"can uhelp me to get in touch with customer support",-2
"help me check at what time i can contact cuswtomer support",-2
"help to check at what time I can call customer support",-2
"i dont know whatto do to talk to customer assistance",-2
"I'm trying to check what hours i can call customer support",-2
"can you tell me what hours I can call customer service?",-2
"help to check what hours customer assistance available is",-2
"I would like to contact customer support, could you help me?",-2
"what do I have to do to call fucking customer support?",-2
"I don't know what to do to speak with cusstomer service",-2
"I want to check what hours I can contact customer support",-2
"ucstomer service mail address",-2
"where do i cherck at what time i can call customer service",-2
"can you tell me at what time I can call customer assistance?",-2
"I need help seeing what hours I can reach customer support",-2
"I have to get in touch with customer service",-2
"help to contact damn customer support",-2
"i have got to talk to customer support",-2
"I want assistance speaking to customer support",-2
"i want help speaking to customer support",-2
"can I check what hours I can reach customer assistance?",-2
"how can i talk to customer assitance",-2
"wanna speak to customer support how can i do  it",-2
"I want help speaking to goddamn customer service",-2
"could you help me talking ot bloody customer service?",-2
"I need to call damn customer support, how could I do it?",-2
"help to see at what time i can call customer assistance",-2
"how do i check what hours i can call customer support",-2
"customer assistance mail address",-2
"can I check what hours I can contact customer service?",-2
"help me check what hours I can contact customer service",-2
"show me what hours I can call customer support",-2
"i dont know how i can contact customer assistance",-2
"help me seeing what hours i can reachb customer service",-2
"i want help to talk to customer assistance",-2
"I want help speaking with customer assistance",-2
"where can I check what hourw I can call customer support?",-2
"I try to see what hours I can reach customer assistance",-2
"I have got to see what hours I can call customer service",-2
"I do not know what to do to speak to customer support",-2
"I would like to call customer service, how to do it?",-2
"I want to talk with customer support, how can I do it?",-2
"help me check at what time i can call customer esrvice",-2
"I have got to speak with customer support, can you help me?",-2
"what is your damn customer assistance number?",-2
"is it possible to talk to customer service",-2
"help to see at what time customer service available is",-2
"help me to see at what time I can contact customer service",-2
"I have got to contact customre support",-2
"I want to see at what time I can call customer support",-2
"help to check what hours i can contact customer assistance",-2
"i want help to check wht hours i can reach customer service",-2
"contactcustomer service",-2
"need help checking whay hours I can reach customer support",-2
"help seing what hours i can contact customer service",-2
"do you have a mail to get in touch with customer assistance?",-2
"i do not know how to call customer assistance",-2
"i want help to talk with customer assistance",-2
"see what hours i can reach customer support",-2
"how do i talk with customer support",-2
"i dont know how i can talk to customer service",-2
"uhave a free of charge number to talk with customer support",-2
"need to speak to customere assistance",-2
"help me talking to customer service",-2
"can I see what hours I can call customer assistance?",-2
"is it possible to talk to customer assistance?",-2
"where do i see what hours i can contact customer support",-2
"assistance to talk to customer service",-2
"can you show me at what time I can contact customer service?",-2
"do you have a number to contact goddamn customer assistance?",-2
"see what hours customer support available is",-2
"I need help contacting customerservice",-2
"i try to see whay hours i can reach customer support",-2
"how to see at what time i can reach customer support",-2
"I have to speak to fucking ucstomer support",-2
"is it possible to talk to customer support?",-2
"i need help to see at what time i can call  customer support",-2
"I am trying to get in touch with customer support",-2
"is it possible to talk to customer assistance ?",-2
"I need to see at what time I can reach customer assistance",-2
"i dont know what i need to do to call customer assistance",-2
"I do not know how to contact cutomer support",-2
"I am trying to call customer support",-2
"I need to talk to customer support, how do I do it?",-2
"how do I check what hours I can call customer assistance ?",-2
"I do not know what to do to speak with customer service",-2
"I need help to call customer support",-2
"I want to see at what time I can call customer service",-2
"how doi see at what time i can reach customer support",-2
"see what hours I can contact customer support",-2
"where do I se what hours I can reach customer assistance?",-2
"I need to call goddamn customer support, help me",-2
"help me to talk to customer support",-2
"I need assistance talking to customer service",-2
"can I talk to customer service?",-2
"show me at what time I can reach customer assistance",-2
"contact customer service",-2
"help me get in touch with customer support",-2
"I want to talk to customer service, how do I do it?",-2
"i want help to see at what time i can reach customer service",-2
"where do I check what hours I can call customer service?",-2
"i dont know what to do to talk to customer support",-2
"can you tell me what hours customer support available is?",-2
"help me checking at what time I can contact customer support",-2
"I do not know what I need to do to talk to customer service",-2
"help checking at what time I can contact customer support",-2
"where can i check what hours i can reach customer assistance",-2
"can I see at what time I can reach customer service?",-2
"i try to get in touch with customer assistance",-2
"i need help to check what hours i can call customer support",-2
"uhave a free number to talk to customer support",-2
"I'm trying to check what hours i can reach customer suport",-2
"I have to contact customer service, how can I do it?",-2
"assistance checking what hours i can reach customre service",-2
"what time can I get in touch with customer support?",-2
"I want to speak with customedr assistance, help me",-2
"I don't know how I can speak with customer service",-2
"can you help me talk to customer assistance ?",-2
"I am trying to talk with customer support",-2
"need help seeing what hours i can contact customer service",-2
"show me at what time i can reach customre service",-2
"need to see what hours i can reach customer support",-2
"how can I check what hours I can contact customer service?",-2
"help me checking what hours customer support available is",-2
"can you help me talk with customer support?",-2
"i need assistance talking with customer service",-2
"I need help seeing what hours I can call customer service",-2
"want help to get in touch with customer assistance",-2
"uhave a free phone number to talk to customer assistance",-2
"do you have a free number to call cjstomer service?",-2
"I try to check what hours customer support available is",-2
"I am trying to see what hours I can contact customet service",-2
"tell me at what time I can call customer service",-2
"help speaking with customer support",-2
"see at what time I can reach customer assistance",-2
"check at what time I can call customer service",-2
"how can i speakto customer assistance",-2
"help checking what hours I can call customer assistance",-2
"wannma speak to customer service how can i do it",-2
"how can I speak to customer support?",-2
"can you help me speak to customer assistance?",-2
"how to check at what time i can call customer service",-2
"could you tell me at what time I can reach customer support?",-2
"I need assistance to talk to customer support",-2
"i dont know what i have to do to talk with customer service",-2
"I do not know how to get in touch with customer assistance",-2
"can I check what hours customer service available is?",-2
"where do I see what hours I can call customer service?",-2
"customer service e-mail",-2
"can you help me to speak to customer support?",-2
"I need to speak to customer service, how do I do it?",-2
"what hours can I call customer service?",-2
"I need help to see what hours I can reach customer service",-2
"I need to speak to customer support, can I get some help?",-2
"tell me at what time i can reach customer support",-2
"do you have a toll-free number to contact customer support?",-2
"how do I see what hours I can call customer assistance?",-2
"do uhave a toll-free number to talk to customer assistance",-2
"I have to contact customer assistance, can I get some help?",-2
"I try to check what hours I can call customer service",-2
"need assistance to speak with customer support",-2
"what do I have to do to talk to customer service?",-2
"tell me at what time customer service available is",-2
"want help to check what hours i cancall customer service",-2
"need to contact customer service how do i do it",-2
"see at what time I can get in touch with customer support",-2
"i have got to get in touch with customerservice",-2
"help me to see what hours I can contact customer assistance",-2
"I want help talking with customer assistance",-2
"how can I see at what time I can call customer assistance?",-2
"check at what time i can contact customer assistance",-2
"I want to talk to fucking customer assistance",-2
"could you help me to speak to customer support?",-2
"i dont know what to do to talk with customer assistance",-2
"what is your customer support phone number?",-2
"what do I need to do to call customer support?",-2
"talk to customer service",-2
"were do I see at what time I can reach customer service?",-2
"i have to see at what time i can contact customer service",-2
"I have to speak with customer assistance",-2
"i have to check at what time custmer support available is",-2
"i need help to ese what hours i can reach customer support",-2
"where do i see at what time i can reach customer support",-2
"I want to get in touch with customer service",-2
"I try to see what hours I can reach customer support",-2
"need to call customer service",-2
"check at what time I can call customer support",-2
"can i check what hours i can contact customer service",-2
"tell me what hours i can get in touch wit customer service",-2
"can I check what hours I can reach customer support?",-2
"can ya help me speak to customer service",-2
"how can I contact cusomer support?",-2
"assistance to talk with customer support",-2
"can I check at what time I can call custoer assistance?",-2
"I'm trying to see what hours i can call customer service",-2
"I have to talk to customer service, how do I do it?",-2
"want help talking with customer support",-2
"I need help talking to customer service",-2
"i have got to call customer service i need help",-2
"help me to see at what time I can contact customer support",-2
"help to get in touch with customer support",-2
"I try to check what hours I can call customer support",-2
"where could I see what hours I can reach customer service?",-2
"hpw to call customer service?",-2
"help me check what hours I can reach customer assistance",-2
"I need to talk with bloody customer support",-2
"how to talk to customer assisance",-2
"where to check at what time i can contact customer support",-2
"I need help to see what hours customer service available is",-2
"need help to see at what time I can contact customer service",-2
"help to see what hours I can contact customer support",-2
"i have got to  talk to customer assistance how to do it",-2
"where do i check what hours i can call customer service",-2
"I try to see what hours I can call customer support",-2
"show me at what time I can contact customer support",-2
"help talking with customer assistance",-2
"help seeing at what time I can reach customer service",-2
"help me call customer service",-2
"I need to see at what time customer service available is",-2
"check at what time I can contact customer service",-2
"can I see what hours I can contact customer support?",-2
"want help to talk to customer srvice",-2
"where do I check what hours I can reach customer service?",-2
"help me seeing what hours customer support available is",-2
"i dont know what to do to talk with customer  support",-2
"how do I see at what time customer assistance available is?",-2
"how do I check what hours customer service available is?",-2
"help to call customer support",-2
"uhave a free number to talk to customer service",-2
"help to talk to customer service",-2
"wanna contact damn customer service i need help",-2
"I don't know what to do to talk to customer service",-2
"I have to contact customer support, help me",-2
"can I contact customer assistance?",-2
"can ya show me at what time customer service available is",-2
"I want help to see what hours I can call customer support",-2
"where can I check what hours I can call customer service?",-2
"assistance to speak with bloody customer support",-2
"I want assistance calling customer support",-2
"i want assistance talking to customer service",-2
"can I check what hours customer assistance available is?",-2
"I don't know how I can speak wih customer service",-2
"what is the bloody customer service phone number?",-2
"do you have a phone number to contact customer assistance?",-2
"i need help seeing what hours i csn call customer service",-2
"check what hours I can reach customer support",-2
"can you help me to get in touch with customer support?",-2
"I try to check what hours customer assistance available is",-2
"assistance seeing what hours I can contact customer service",-2
"I need help to see what hours I can call customer assistance",-2
"help me to see what hours customer support available is",-2
"I need to call customer support, how do I do it?",-2
"I would like to call customer assistance, how could I do it?",-2
"how do I see what hours I can contact customer assistance?",-2
"I want help to contact customer assistance",-2
"what hours can i get in touch with customer service",-2
"I do not know how I can speak to customer service",-2
"I want help to talk to customer service",-2
"help to talk with customer assistance",-2
"I want to talk with fucking customer support, help me",-2
"I have to call customer service, could you help me?",-2
"I don't know how I can contact customer assistance",-2
"need assistance to speak to customer servkce",-2
"how can I speak to customer assistance?",-2
"i have to see what hours i can contact customer uspport",-2
"what time can I reach customer support?",-2
"where can i see at what time i can reach customer assistance",-2
"what is the customer support working hours?",-2
"I want to call customer service, how can I do it?",-2
"check at what time i can reachy customer support",-2
"I want to see at what time I can contact customer assistance",-2
"how to get in touch with goddamn customer service",-2
"how do I talk to damn customner support?",-2
"I have to talk with customer service, how can I do it?",-2
"where can I check what hours I can contact customer support?",-2
"need help checking whatt hours customer support available is",-2
"I don't know what to do to contact customer assistance",-2
"I don't know how to get in touch with customer support",-2
"I want to see at what time I ca contact customer assistance",-2
"i want assistance to call customer support",-2
"how can I talk to customer assistance?",-2
